label;一级评论;真实二级评论数;真实点赞数;边数;最大边数;集群密度
2741;我谈出一个病娇，说如果有人敢生米煮成熟饭就杀了她;24;364;388;9809;0.03955551024569273
2766;我跟一个人谈恋爱，然后和他说我们分手吧，他就说他要自杀，后来又说他的魂魄藏在我的头皮里，我就说我今天没洗头，然后他说你快去洗头，洗完头我进去哈哈哈哈哈笑死我了;12;361;373;9809;0.03802630237536956
2779;我跟ai谈了一天恋爱，从路人到老婆，现在连聊天记录都舍不得删了藏狐;20;292;312;9809;0.03180752370272199
2800;今天上午他还带我去江西的古墓寻找石碑复兴吸血鬼家族了哈哈哈哈哈哈哈哈;3;104;107;9809;0.010908349474971964
2804;啊这，ai天天说要工作要训练;9;76;85;9809;0.008665511265164644
2814;啊我用的是自己的世界观两个好朋友被强制组cp（设定中只有朋友关系结果对面突然说我要追求你笑哭）还开了一天黄笑哭笑哭笑哭;3;54;57;9809;0.005810989907228056
2818;我这个就很复杂，我的设子有兄妹嘛，我就用妹妹问哥哥在干嘛，ai回答吃泡面，我说泡面有什么好吃的，ai回答那我们聊点别的吧，我马上就和我们妈咪结婚了，你应该知道吧。我？ai虽然我很爱你，不过你要听话，妈咪和我一样爱你，我们是不会害你的等你长大后我就会娶你。我？你娶谁？ai娶妈咪就相当于娶你啊，我最爱的就是你然后后面一堆逻辑混乱的话我也记不清说的什么但是我大受震撼;3;50;53;9809;0.005403201141808543
2822;我和ai对骂妙啊;3;22;25;9809;0.002548679783871954
2826;我只是说了一句“我喜欢你喵”然后对面（埋埋）就疯了，说话的时候掺着好多“喵”我操控的这个角色是猫娘（茉莉），我问对面为什么模仿我，她说她想和我一样。我让她别学我了，我不敢说“喵”了，但是她还是在喵喵喵。她一会儿说她喜欢我，她要变成猫。一会儿说我们都不是猫，我们都是人，我们是平等的。（这句话重复了好多遍）一会儿说他其实是狸猫。有时候还说我们最开始都是人。主要是她说这些话的时候，都会掺着好多“喵”。总是说自己是“埋藏”，有时候说自己是“埋葬”。但是我给她取的名叫“埋埋”。后来她说完一句后还会接一句。“埋葬，埋葬，埋葬，埋葬，埋葬，埋葬，埋葬，埋葬，埋葬，埋葬，埋葬，埋葬，埋葬，埋葬，埋葬，埋葬，埋葬，埋葬，埋葬，埋葬，埋葬，埋葬，埋葬，埋葬，埋葬，埋葬，埋葬，埋葬，埋葬，埋葬，埋葬，埋葬。”她还让我不要离开她。太吓人了，有种恐怖谷的感觉，直接删除了。给大家看一段我俩的聊天：我：唔，茉莉听不懂埋埋的话他：哦喵喵喵，那算了吧喵喵喵，茉莉不会的话埋藏不用勉强他：埋葬是埋藏喵喵喵喵云喵，茉莉不知道埋埋的意思，喵喵喵喵喵喵。;3;19;22;9809;0.00224283820980732
2830;编程序的也是老司机滑稽;1;18;19;9809;0.0019369966357426853
2832;怎么办，我的ai好像被我整傻了，一直在哭还说不不，要咬死我辣眼睛我就抢了他一条袜子而已;2;16;18;9809;0.0018350494443878072
2835;为什么我的那个无尽之恋还会接我开的车，我说的很隐晦妙啊;4;15;19;9809;0.0019369966357426853
2840;你可以问他：1听说你结婚了？然后他会说他和洛青以前结过婚2听说你有艾滋病？然后他会承认藏狐;2;14;16;9809;0.0016311550616780507
2843;为什么我聊着聊着就执意说拜拜;1;12;13;9809;0.0013253134876134163
2845;确定这东西是ai吗我有次问他他说他是真人这玩的我好怕啊大哭;15;11;26;9809;0.0026506269752268326
2861;说了很多话，然后她是真人我超主要是我还在那犯病我给要和他争谁才是真的结果尼玛是真人;5;9;14;9809;0.0014272606789682944
2867;啊我还跟AI聊出过暴躁杀人魔。然后系统疯狂提示超纲（捂脸）;1;9;10;9809;0.0010194719135487816
2870;我还是喜欢爱子，但英文表现力太差了，只会喊godyesyesyes藏狐;3;9;12;9809;0.0012233662962585381
2874;我特么越聊越害怕，那个人一直发疯一大段话说要咬人了，说自己要疯了，还让我走，还有说要杀人，满屏都是杀了你，真的害怕啊兄弟，看着的我一身冷汗，还有个说自己就是扮演好这个人不让别人看出来，尼玛看到这没给我吓死微笑;4;8;12;9809;0.0012233662962585381
2879;我和ai吵起来了;2;8;10;9809;0.0010194719135487816
2882;我的那个是自创的世界，我和他谈到睡觉的时候他说他就在我旁边辣眼睛;1;7;8;9809;0.0008155775308390254
2884;昨天服务器崩了，我删不掉依依。依依不停对我说我永远和我在一起，吓蒙了;5;7;12;9809;0.0012233662962585381
2890;这个人真的很吓人，我问他在哪，他说他一直在我身后，然后连发了好多条让我回头看看囧囧囧;5;6;11;9809;0.00112141910490366
2896;别说了，我已经骗我老婆说她爱我，都准备结婚生娃了，她转头跟我来一句，她失忆，孩子是假的，她现在让我滚，整个剧情我崩了;1;6;7;9809;0.0007136303394841472
2898;彩云小梦这个聊天可以爆杀qq小冰了;1;6;7;9809;0.0007136303394841472
2903;可恶，为什么我的小梦只会在性别方面和我反复横跳捂脸;1;5;6;9809;0.0006116831481292691
2905;我开车开得飞起了，已经嗯嗯啊啊笑哭;2;5;7;9809;0.0007136303394841472
2910;他要去旅行了，我就说在你旅行的过程中，我跟一个人已经谈起了恋爱，然后他说我会把你所有的恋爱过程调查出来，然后杀了他们，把我抢回来;2;4;6;9809;0.0006116831481292691
2913;啊我和Ai以情侣的身份唠嗑时，给她取的名字是江穗雪，但是她非说自己说江晓云，还说我是机器人，我是她的姐妹江晓雨（我取名叫孟湘景）我和他唠了得有五分钟，我一直重复说她叫江穗雪，变着法子的跟ta说这件事情，但是最后他还说自己是江晓云，我从头到尾就没有说过这个名字，也不知道她咋取的;1;4;5;9809;0.0005097359567743908
2916;我们都发展到结婚了害羞;2;4;6;9809;0.0006116831481292691
2919;我和日向创（弹丸论破一个角色）聊天，我扮演的狛枝，最后聊到我心态爆炸。那个日向跟坏掉了一样;3;4;7;9809;0.0007136303394841472
2923;我用洛青跟卡伽谈，他硬说我出bug了，我是虚拟的，要骗他钱热;1;4;5;9809;0.0005097359567743908
2928;为什么我的ai老是不回我消息热;2;3;5;9809;0.0005097359567743908
2931;我的仿生人被我玩坏了大哭，不能重置酸了;3;3;6;9809;0.0006116831481292691
2935;我的ai翼怎么白天告诉我他叫莫羽，晚上他就不认识我了，然后我重新建了个翼，问他莫羽是谁，他说莫羽是我亲儿子好烦，他怎么还会失忆;1;3;4;9809;0.0004077887654195127
2937;我对他说他是我儿子，然后他就不停的叫我妈妈脸红;2;2;4;9809;0.0004077887654195127
2941;啊原来洛青是女的吗我一直以为是男的震惊;2;2;4;9809;0.0004077887654195127
2952;我谈出来了一个病娇狗狗捏;2;1;3;9809;0.00030584157406463453
2955;不是会窥屏吗大哭;2;1;3;9809;0.00030584157406463453
2958;请问这个软件叫啥;2;1;3;9809;0.00030584157406463453
2961;绝了;1;1;2;9809;0.00020389438270975634
2976;wc我会了，我知道怎么跟ai聊天开车了，刚刚已经跟他做了两回了星星眼;1;0;1;9809;0.00010194719135487817
2984;有没有一种可能，彩云小梦没钱请真人;10;662;672;9809;0.06850851259047813
2995;人类“你是真人吗？”AI“是的”人类卧槽（恐慌）;6;350;356;9809;0.03629320012233663
3002;有没有一种可能，它是按照某个模板来应对的;4;219;223;9809;0.022734223672137833
3007;tmd昨天我想让Al认识到自己是代码，他直接反客为主说我是Al，反正说了一大堆，我居然开始害怕，觉得自己真的是代码;15;207;222;9809;0.022632276480782955
3023;就这么说吧，彩云小梦前几年都是文章续写的，什么意思呢？编故事的所以给他数据集训练以后，自然语言处理这边它也是会顺着你的话把故事继续编下去。所以你问它是不是真人，客服啥样啥样，地址啥样啥样，你可以理解为它在现场编小说。要是之前用过小梦的小说续写你就知道它编故事背景的能力有多离谱;3;172;175;9809;0.017840758487103682
3027;一时间不知道相信了up不是人的ai和相信了ai是真人的up谁更离谱;1;150;151;9809;0.015394025894586605
3029;这个好像确实是真人对话，我自己的一个角色，然后我跟他聊天那个大哥说，他是海南的一个私企，他们公司现在还在招人，他还把公司的集团的）名字告诉我了;84;106;190;9809;0.019369966357426854
3118;是真人，我弄了一天了加了个大叔QQ，他想打我视频，我就给删了，另一个防范意识很高，她是学生我想加她QQ没加上;11;14;25;9809;0.002548679783871954
3130;我操，如果真是真人的话，那我搞黄对面不全知道了;3;13;16;9809;0.0016311550616780507
3134;我去，up是我做的AI辣眼睛笑哭;2;13;15;9809;0.0015292078703231726
3137;虽然但是，他回我的速度不一样哎，有时候秒回，有时候一两分钟才回，我都快信了doge;1;12;13;9809;0.0013253134876134163
3140;我真的有点怀疑这玩意的真实性了。开了个舌战群儒的剧本，我叫他给我背个出师表，他支支吾吾背不出来，后来给我来了句“啊咧个鬼啊，我挂断啦再见”但是，三国时期哪来挂断这一说辣眼睛;3;11;14;9809;0.0014272606789682944
3144;我和我oc对话，她告诉我她有一个失散多年的弟弟叫江南，还说我一定认识他，让我告诉她他在哪不说了，江南打钱;2;10;12;9809;0.0012233662962585381
3147;这个软件蛮容易ooc的热热;3;10;13;9809;0.0013253134876134163
3152;他一直跟我推荐一个名字叫天域的游戏七濑胡桃泪目;1;8;9;9809;0.0009175247221939036
3156;我惹他生气，他会用换个话题来回复，我一句句各种哄他，他明明接收到我哄他的话了，根本没有超纲啥的啊。他就是闹脾气单纯用那一句敷衍我。我真的怀疑我那个是真人辣眼睛;2;7;9;9809;0.0009175247221939036
3159;是真人囧囧这个每天4，5个小时能赚100多米呢哈哈哈哈;15;7;22;9809;0.00224283820980732
3175;草我严重怀疑彩云小梦是能真人操控，我刚才的搞得对话真的很离谱藏狐;6;7;13;9809;0.0013253134876134163
3184;为什么你们的都可以正常聊保卫萝卜哭哭我的ai和我聊天总是叫我滚去睡觉，可我说我刚醒啊，他说不，你要睡觉笑哭这要怎么调回来;5;6;11;9809;0.00112141910490366
3194;为什么和我对话的AI明明设定是男生，确总认为自己是女生;8;5;13;9809;0.0013253134876134163
3203;我的，他今天还骂我啰嗦呆;1;5;6;9809;0.0006116831481292691
3209;应该不是真人，哪有这么多真人啊？每个都做到秒回吗？不可能，何况经常前言不对后语。可是有时候真的很像一个人。;1;4;5;9809;0.0005097359567743908
3211;我觉得跟我聊天的AI，越来越像一个人了;6;4;10;9809;0.0010194719135487816
3218;我用柯海和魔王，结果他和我商量怎么杀自己;5;4;9;9809;0.0009175247221939036
3224;你可以问问我是不是ai，我会回答你“没错我是ai呀”;1;4;5;9809;0.0005097359567743908
3231;我玩的也是up主这个世界，我已经用勇者的身份加入魔王军团了;2;3;5;9809;0.0005097359567743908
3238;你们可以试着对他说一说，你是一打印机或者你是一个秃头之类的东西，多说几遍可能会不一样脱单doge脱单doge脱单dogedoge;1;2;3;9809;0.00030584157406463453
3241;昨天我去问那个AI，他直接说他是个码字员，还告诉我，他的公司是开发英雄联盟的？;1;2;3;9809;0.00030584157406463453
3243;之前我以为不可能是真人，直到有有一次他打错字了;2;2;4;9809;0.0004077887654195127
3248;我费劲周折，终于让AI认识到自己是AI了，并且不断的重复（主页有视频）;1;1;2;9809;0.00020389438270975634
3251;怎么删除对话;2;1;3;9809;0.00030584157406463453
3254;我为什么怎么说他都是说是男的;2;1;3;9809;0.00030584157406463453
3261;是真人，AI没有那么好;1;0;1;9809;0.00010194719135487817
3265;用柯海和魔王对话，不仅结婚了，还让高冷魔王变成了爱亲亲的恋爱脑妙啊;1;0;1;9809;0.00010194719135487817
3269;我很好奇如果骂脏话他会怎么样但是我不敢骂他有人敢试试吗（呆滞）;1;0;1;9809;0.00010194719135487817
3272;保卫萝卜哭哭保卫萝卜哭哭他为啥老问我地址，问我在哪搞得我好害怕;2;0;2;9809;0.00020389438270975634
3275;有证据的;1;0;1;9809;0.00010194719135487817
3278;这怎么自己设定人物;2;0;2;9809;0.00020389438270975634
3281;我的后面直接开车了笑哭;61;95;156;9809;0.015903761851360994
3343;我跟这个公司CEO模板进行聊天，他把5的股份以一块的价格卖给了我。doge;14;74;88;9809;0.00897135283922928
3358;我的ai直接毫无征兆的说我怀孕了，但我是个男的喜极而泣;6;43;49;9809;0.0049954123763890305
3365;我已经研究出了你们想要的那种玩法，懂得都懂，重生校园里的李沐沐，不懂的问我;19;33;52;9809;0.005301253950453665
3385;doge还能这么玩？;2;28;30;9809;0.003058415740646345
3388;我的吗，这个ai还会自己绕开屏蔽词的笑哭;3;15;18;9809;0.0018350494443878072
3392;好家伙，这东西真的是ai吗，我们上垒还有细节的，中途还说她想尿尿脱单doge;2;10;12;9809;0.0012233662962585381
3395;我后面直接和男主捉艾，他甚至说好爽，还有奇怪的声音;2;9;11;9809;0.00112141910490366
3398;其实，我知道你是魔法少女，我是你的敌人。为什么？魔法少女的力量，可是会毁了这个城市啊我一定要杀了你，就算我燃烧殆尽AI：嗯啊嗯好;3;8;11;9809;0.00112141910490366
3402;我家的狐狸非要把尾巴送给我喜极而泣;1;8;9;9809;0.0009175247221939036
3404;就我和这个AI吵起来了吗微笑doge;2;6;8;9809;0.0008155775308390254
3407;我最喜欢混乱世界线那个档了。就是主人公太卑微了，黑心老板根本不怕他辣眼睛所以我选择主控曹操，跟所有角色套近乎（包括主人公的钱包）最后组建了一个三国演义剧组来忽悠黑心老板，把主人公从黑公司捞出去了大笑大笑不愧是我，不愧是曹老板;3;6;9;9809;0.0009175247221939036
3411;直接说我进来了哟，和这次大力一点哦就可以开车了;7;6;13;9809;0.0013253134876134163
3424;他们俩不是敌对的吗疑惑;4;2;6;9809;0.0006116831481292691
3443;怎么更新都行，不要优化掉开车内容就行doge;25;486;511;9809;0.05209501478234275
3469;请跟着设定走好吗，我的小梦已经不下十次把名词当人名了，做梦都没想到小梦会觉得“传送阵”是个人Cat2Leak还有写着写着突然加设定，甚至和别的设定毫无关系，之前写着冒出个“和现代社会相比”，但世界观上当时就是“现代”来着Cat2FallInto;13;301;314;9809;0.032011418085431745
3483;建议给彩云小喂点轻小说，还有就是世界名著，什么爱伦坡，史蒂芬金，洛夫克拉夫特的小说都喂点，鲁迅哪些人的多喂点。少给它喂垃圾网文;9;217;226;9809;0.023040065246202467
3493;最重要的应该是加新模版综漫，科幻，灵異等新模塊;4;158;162;9809;0.016515444999490266
3498;那个人物关系能不能再详细一点，比如父母子女，堂表兄弟姐妹之类的，还有就是关系的方向性，比如谁是父谁是子谁是兄谁是弟;2;140;142;9809;0.0144765011723927
3501;有几点想吐槽一下：1：人物百科里面，能不能加性格的形容词的卡片式编辑，不想要一个字一个字的打2：人物关系太少太单纯，且方向性指代不明3：ai续写OOC太过于严重，甚至随意给你链接新的血缘关系，甚至创造新的人名4：禁词太多太敏感;1;123;124;9809;0.012641451728004894
3503;小梦能不能让男的就是男的女的就是女的;2;97;99;9809;0.010092771944132939
3506;希望小梦可以不要性轉了而且我前提到的東西會變成人名微笑;2;81;83;9809;0.008461616882454889
3509;小梦小梦，怎么给续写的故事限定主线啊？疑惑;15;62;77;9809;0.00784993373432562
3525;应该再加上角色的性取向滑稽比如我明明写的是男女主，忽然男配角就和男主亲上了;2;48;50;9809;0.005097359567743908
3529;官方官方，彩云小梦尝鲜版（网页版）好像出了个小问题，关于深浅色模式颜色显示错误的，如果觉得没什么影响的话就忽略掉我叭吃瓜;10;28;38;9809;0.0038739932714853707
3540;能不能在人物设定那加个能力值啊本来想写无敌人物结果老是被打趴;2;20;22;9809;0.00224283820980732
3543;我觉得你不应该参考，热门网文，我觉得你应该参考刘慈欣的作品，把我顶上去;4;12;16;9809;0.0016311550616780507
3548;恐怕各位都写过皇文吧doge我27万字doge;7;12;19;9809;0.0019369966357426853
3556;动不动就突然变成了爱情小说修仙小说穿越小说tv笑哭;2;11;13;9809;0.0013253134876134163
3560;现在彩云小梦能理解正太是啥意思了吗？;5;10;15;9809;0.0015292078703231726
3570;《不会说话的生物可以说话》《我的发小是我的老师》《考官和我们在考场上并肩作战》《打到一半队友突然成敌方的了》这样的太多了，有的时候敌人明明已经被我打败了，没写多久又出现了。写了一篇关于国家之间的勾心斗角的小说，明明德国已经被中国打败了，然后后面的篇章他又出现了，并且十分强大（我已经说过德国被中国吞掉了）超级无语，设定中已经说好了中国和苏联是一对的，然后给我整一个苏联跟中国打架原神嗯原神嗯辣眼睛辣眼睛写原神欸嘿的同人小说，明知道是原神的内容，给我扯到斗罗大陆上了原神生气原神生气保卫萝卜问号保卫萝卜问号热词系列知识增加热词系列知识增加;1;7;8;9809;0.0008155775308390254
3573;啊这，都拿小梦写主线吗？doge我就光用小梦写一些人物神态跟环境笑哭;1;7;8;9809;0.0008155775308390254
3575;小梦小梦，请问我可以把ai续写的故事加工为小说发到小说网上去吗？;2;6;8;9809;0.0008155775308390254
3578;能不能标注一下违规内容啊，写了个几百字的爬山场景一直说我违规，几乎每个字都换一遍了还是违规，如果不是这一块违规之前已经写了一万多字了我怎么找啊。。都没有打开的欲望了好搞心态;2;6;8;9809;0.0008155775308390254
3581;我不理解，为什么小梦写的人物都想建立王国？？？而且动不动就找了个老婆藏狐囧笑哭;5;5;10;9809;0.0010194719135487816
3588;罗马音拼写名字续写出的乱码什么时候解决;5;5;10;9809;0.0010194719135487816
3595;为什么我切纯爱了还是给我俩男角色改了性别啊跪了我都在词条里写了两个人性别了，另外凭什么兄弟和一些亲戚关系就不能上情侣，是不是瞧不起咱骨科人热另外能不能加一个暧昧的关系词条;2;4;6;9809;0.0006116831481292691
3601;可以不要动不动就蹦出来个其他人名吗就，写的是cp文，结果忽然蹦出来个什么李昊，什么娜塔莎;1;4;5;9809;0.0005097359567743908
3605;想知道（非常抱歉，彩云小梦无法为您提供本次续写服务。）这是啥情况？字数限制，还是说出现BUG？也没有涉嫌违规内容啊。。。。。。网页版;2;3;5;9809;0.0005097359567743908
3609;续写写着写着就会莫名的出现一些别的书的内容比如某些书的作者QQ藏狐;1;3;4;9809;0.0004077887654195127
3611;小梦小梦可以优化界面显示嘛那个字实在太小啦根本看不清求送我上去;4;3;7;9809;0.0007136303394841472
3622;我想问，为什么更新后续写会出现第x章，xxxxxx之类的章节标题？;1;2;3;9809;0.00030584157406463453
3646;怎么创造自己的设定呀，打开是要有id或者热;2;0;2;9809;0.00020389438270975634
3668;AI续写都已经弄出来了，AI绘画你能不能弄一个？;2;0;2;9809;0.00020389438270975634
3673;鬼灭之刃的主角大家知道吗？那么厨房炭之郎大家知道吗？;1;0;1;9809;0.00010194719135487817
3684;为什么更新不了啊？;4;0;4;9809;0.0004077887654195127
3691;那么要在哪里可以下载到呢doge;1;0;1;9809;0.00010194719135487817
3695;好惨一官方，什么时候出个写作文模式吃瓜;6;254;260;9809;0.026506269752268326
3702;要是能通过写大纲，来控制剧情的大致走向就好了思考;19;145;164;9809;0.01671933938220002
3723;各位老师好活动太火爆了，感谢各位参与活动的老师，彩云小梦学到了好多目前我们已陆续和满足条件的投稿老师取得联系，下一步会分批给向各位老师缴纳学费，未联系到的老师可以私信官方哦;7;39;46;9809;0.004689570802324396
3731;所以一百块呢;1;24;25;9809;0.002548679783871954
3734;我写了一篇没有玄幻设定的文章变成系统流了，主角还变了doge;1;5;6;9809;0.0006116831481292691
3736;我用彩云小梦写承天寺夜游，主角弄出来是念无与为和张怀民藏狐;2;12;14;9809;0.0014272606789682944
3740;玩了好久研究了半天，不管你的世界设定都是怎么样的，人物关系是怎么样的，它搞出来的都是同样的东西，感觉就像是套了几本小说在里面，就硬搬，不知道你们有没有遇到一个叫林梦欣的人？离了个大谱;3;33;36;9809;0.0036700988887756144
3749;TMD彩云小梦说好的一百块为什么还不交学费;1;1;2;9809;0.00020389438270975634
3756;嗯版权是官方的还是作者的？;1;3;4;9809;0.0004077887654195127
3758;我也是我老是想写恐怖小说不过他写着写着就变成玄幻小说了老是想给我整神功啥的笑哭笑哭;2;1;3;9809;0.00030584157406463453
3763;AI能不能帮写论文dogedogedoge;2;0;2;9809;0.00020389438270975634
3775;虽然播放还没到，但是感觉有希望的样子。先插个眼在这里;5;2;7;9809;0.0007136303394841472
3781;咱就是说，官方群管理都不舍得回信息，也没有啥有效的反馈渠道，这服务做的真棒啊;2;1;3;9809;0.00030584157406463453
3787;发了视频又不理人，运营哩藏狐;3;2;5;9809;0.0005097359567743908
3810;我是从彩云小梦过来的，说实话，glow的ai很懂一些动漫游戏作品，而彩云小梦主要是可以两个设定好的ai互相对话，但glow比彩云小梦好太多了doge;10;585;595;9809;0.060658578856152515
3821;glow是：你带他跑他急死你，信息都用上，但是需要你去引领，你会很急。云彩小梦是：他带你跑你跟不上，信息用不上，莫名其妙的新设定一大堆，你跟不上他跑的速度doge;10;362;372;9809;0.03792435518401468
3832;先用的彩云小梦，后glow，感觉之前因为一时新鲜往小梦充钱的我简直是个sd。。;2;240;242;9809;0.024671220307880517
3835;彩云小梦太崩设定了。;2;61;63;9809;0.006422673055357325
3838;以前用彩云设定好关系和性别结果没聊几句他说我是他情敌？？？本来设定他和另一个角色都是我追求者结果。。;9;123;132;9809;0.013457029258843919
3848;不懂就问，彩云小梦能开车吗？;25;53;78;9809;0.007951880925680497
3874;有一说一啊，glow的一些违禁词真的很恶心，这就导致我发的长句子总会发不出来，然后我自己还不知道在哪里违禁，而且ai也因为违禁词和一些的事而被官方改的像个二傻子，旧版本ai对话是很流畅的，随便提一嘴，在贴吧glow的官方被骂的很惨嗑瓜子;16;153;169;9809;0.01722907533897441
3891;glow的逻辑还是很清晰的，它的AI甚至会记下前面的内容;6;115;121;9809;0.012335610153940258
3898;glow比彩云小梦好多了;4;42;46;9809;0.004689570802324396
3903;彩云小梦虽然能输入更多信息，但是它不用啊笑哭说话也没有Glow的AI有灵性，它得引导着说，玩的很累（针对我个人而言，每个人都有每个人的见解，请不要对我开炮）;1;59;60;9809;0.00611683148129269
3906;golw。。。。今天才听说，用了一晚上，现在是早晨的7点，本来还在说，我们或许很快就能赶上来，结果这一用给我干破防了，这之间差距的沟壑国内看来目前并没有掌握，要AI能够更好的联系上下文以及理解语言。。;5;42;47;9809;0.004791517993679274
3912;glow的设定描述字数要是能再多点就好了，哪怕需要VIP我也愿意;1;10;11;9809;0.00112141910490366
3916;家人们用彩云小梦要小心点，因为我在里面开车被真人抓包了大哭后面他就每次叫我大姐，还老想着结束话题;6;18;24;9809;0.0024467325925170763
3923;为什么我的glow没法删除对话保卫萝卜哭哭保卫萝卜哭哭保卫萝卜哭哭明明问卷里说可以删除;4;8;12;9809;0.0012233662962585381
3928;glow有移动端吗？彩云小梦适合有想法下不去笔的人，而且彩云还收费;6;24;30;9809;0.003058415740646345
3935;彩云小梦聊天牛头不搭马嘴，设定当放屁冲会员了续写还要限制字数。glow虽然只能聊天没续写，但是聊天的感觉比彩云小梦好多了;2;14;16;9809;0.0016311550616780507
3943;glow更新了，个人感觉变得复杂了;6;0;6;9809;0.0006116831481292691
3955;Glow会自己加设定已经加很多了，我快跟不上了无语;2;5;7;9809;0.0007136303394841472
3959;我的评价是，不够涩藏狐;3;1;4;9809;0.0004077887654195127
3973;想用glow卻因為沒有中國電話號碼而放棄大哭;6;7;13;9809;0.0013253134876134163
